[
  {
    "schema": "jarvis.web.event.v1",
    "protocol_version": "1.0",
    "contract_fingerprint": "445e4013df96ad986232eaecec6c58c01bab472e2a55c5ec11c54536de552021",
    "event_id": "event-replay-001",
    "sequence": 1,
    "cursor": "cursor-replay-001",
    "type": "message.accepted",
    "timestamp_utc": "2026-09-10T08:00:00Z",
    "user_id": "owner-001",
    "device_id": "device-001",
    "session_id": "session-replay-001",
    "conversation_id": "conversation-replay-001",
    "request_id": "req-replay-001",
    "trace_id": "trace-replay-001",
    "task_id": "task-replay-001",
    "run_id": "run-replay-001",
    "action_id": null,
    "optional": false,
    "payload": {"state": "ACCEPTED"}
  },
  {
    "schema": "jarvis.web.event.v1",
    "protocol_version": "1.0",
    "contract_fingerprint": "445e4013df96ad986232eaecec6c58c01bab472e2a55c5ec11c54536de552021",
    "event_id": "event-replay-002",
    "sequence": 2,
    "cursor": "cursor-replay-002",
    "type": "message.delta",
    "timestamp_utc": "2026-09-10T08:00:01Z",
    "user_id": "owner-001",
    "device_id": "device-001",
    "session_id": "session-replay-001",
    "conversation_id": "conversation-replay-001",
    "request_id": "req-replay-001",
    "trace_id": "trace-replay-001",
    "task_id": "task-replay-001",
    "run_id": "run-replay-001",
    "action_id": null,
    "optional": false,
    "payload": {"delta": "Hola"}
  },
  {
    "schema": "jarvis.web.event.v1",
    "protocol_version": "1.0",
    "contract_fingerprint": "445e4013df96ad986232eaecec6c58c01bab472e2a55c5ec11c54536de552021",
    "event_id": "event-replay-002",
    "sequence": 2,
    "cursor": "cursor-replay-002",
    "type": "message.delta",
    "timestamp_utc": "2026-09-10T08:00:01Z",
    "user_id": "owner-001",
    "device_id": "device-001",
    "session_id": "session-replay-001",
    "conversation_id": "conversation-replay-001",
    "request_id": "req-replay-001",
    "trace_id": "trace-replay-001",
    "task_id": "task-replay-001",
    "run_id": "run-replay-001",
    "action_id": null,
    "optional": false,
    "payload": {"delta": "Hola"}
  },
  {
    "schema": "jarvis.web.event.v1",
    "protocol_version": "1.0",
    "contract_fingerprint": "445e4013df96ad986232eaecec6c58c01bab472e2a55c5ec11c54536de552021",
    "event_id": "event-replay-future-001",
    "sequence": 3,
    "cursor": "cursor-replay-003",
    "type": "ui.future_hint",
    "timestamp_utc": "2026-09-10T08:00:02Z",
    "user_id": "owner-001",
    "device_id": "device-001",
    "session_id": "session-replay-001",
    "conversation_id": "conversation-replay-001",
    "request_id": "req-replay-001",
    "trace_id": "trace-replay-001",
    "task_id": "task-replay-001",
    "run_id": "run-replay-001",
    "action_id": null,
    "optional": true,
    "payload": {"hint": "ignore"}
  },
  {
    "schema": "jarvis.web.event.v1",
    "protocol_version": "1.0",
    "contract_fingerprint": "445e4013df96ad986232eaecec6c58c01bab472e2a55c5ec11c54536de552021",
    "event_id": "event-replay-003",
    "sequence": 4,
    "cursor": "cursor-replay-004",
    "type": "message.completed",
    "timestamp_utc": "2026-09-10T08:00:03Z",
    "user_id": "owner-001",
    "device_id": "device-001",
    "session_id": "session-replay-001",
    "conversation_id": "conversation-replay-001",
    "request_id": "req-replay-001",
    "trace_id": "trace-replay-001",
    "task_id": "task-replay-001",
    "run_id": "run-replay-001",
    "action_id": null,
    "optional": false,
    "payload": {"text": "Hola"}
  }
]
